id,title,author,genre,description,rating,date,completed,age,free,link
784843,멸망급 빌런들의 선생님,이지 / 떡구이 / SANA,"스토리, 판타지","“멸망급 빌런이 될 운명인 아이들을 헌터로, 그것도 전설급 헌터로 만든다면 멸망을 막을 수 있지 않을까?”가만히 있으면 기다리는 것은 그저 처참한 멸망뿐인….",5.1,2022.06.04 22:00,FALSE,전체연령가,TRUE,https://comic.naver.com/webtoon/list?titleId=784843
791892,멸종위기종인간,사하라,"스토리, 판타지","어느 날 모두의 소원이 이루어지자,우리는 멸종위기에 몰렸다.",9.12,2022.06.07 22:54,FALSE,15세 이용가,FALSE,https://comic.naver.com/webtoon/list?titleId=791892
786908,모기전쟁,정지훈,"스토리, 판타지","모기가 지구 최강의 포식자로 거듭난 후 100년, 아직 인류의 희망은 사라지지 않았다!",9.94,2021.12.27 10:00,TRUE,,TRUE,https://comic.naver.com/webtoon/list?titleId=786908
794942,모노마니아,구리,"스토리, 드라마","사랑스러운 외모와 밝은 성격으로 인기가 많은 '지우'. 하루가 멀다 하고 고백을 받지만, 막상 연애를 시작하면 집착하는 습관 때문에 금방 차이고 만다. 아무도 지우를 이해해 주지 않았지만, 어느 날 나타난 편입생 '이재'만이 그녀의 이야기를 들어준다.지우는 이재에게 점차 빠져들고 묘한 소유욕까지 느끼게 되는데...이재의 진짜 관심사는 뭘까?​",9.76,2022.06.05 22:30,FALSE,15세 이용가,FALSE,https://comic.naver.com/webtoon/list?titleId=794942
521504,모던패밀리,외눈박이 / 시현,"스토리, 개그",행복한 가정을 이루기 위해 고군분투하는 어느 수상한 가족 이야기.그들의 기상천외한 리얼 감성 코믹극!,9.94,2014.03.07 23:15,TRUE,전체연령가,FALSE,https://comic.naver.com/webtoon/list?titleId=521504
617882,모던패밀리 2,외눈박이 / 시현,"에피소드, 개그",행복한 가정을 이루기 위해 고군분투하는 어느 수상한 가족 이야기그 두번째 시즌!,9.68,2016.06.17 23:14,TRUE,전체연령가,FALSE,https://comic.naver.com/webtoon/list?titleId=617882
764128,모두 너였다,이순기 / 오정호 / 이재익,"스토리, 로맨스","근 미래, 생체공학박사이자 클론 테스터 '유리'는 남편의 외도로 하루하루를 고통 속에 살고 있다.그러던 어느 날, 한달 후 폐기될 운명의 최신형 연애클론 '빅터'를 테스트하기 시작한다. 그녀는 어느샌가 빅터로부터 마음의 위안을 얻는 한편, 남편이 자신에게 저지른 끔찍한 일들을 깨닫게 되는데...!",9.95,2022.06.03 22:58,FALSE,12세 이용가,FALSE,https://comic.naver.com/webtoon/list?titleId=764128
471283,모두에게 완자가,완자,"에피소드, 일상","아무도 눈치보지 않고 사랑할 수 있는 그날이 오기를!
사랑하며 살아가는 그녀들의 일상이야기 <모두에게, 완자가>",9.71,2015.02.14 23:20,TRUE,12세 이용가,FALSE,https://comic.naver.com/webtoon/list?titleId=471283
604146,모디파이,임달영 / 이수현,"스토리, 드라마","최고가 될 수 있는가!  
스피드의 모든 것을 건 R.C 레이서들의  
국내 최초 본격 R.C 웹툰!",8.61,2014.10.11 23:09,TRUE,15세 이용가,FALSE,https://comic.naver.com/webtoon/list?titleId=604146
734918,모락모락 왕세자님,원해,"스토리, 로맨스",온천마을에 찾아온 꽃미남 왕세자일행과신비한 힘을 가진 소녀의 판타지 로맨스,9.89,2022.06.05 22:56,FALSE,전체연령가,FALSE,https://comic.naver.com/webtoon/list?titleId=734918
772243,모스크바의 여명,타이밍 / 이샨오 / 황장미,"스토리, 드라마","21세의 피아니스트 이시윤.사고로 인해 피아노를 더 이상 칠 수 없게 된 삶을 비관하다 죽음을 택했지만,알아들을 수 없는 외국어로 얘기하는 갑부 집안에서소녀 '타티아나'로 눈을 뜬다.신이 주신 기회인 걸까? 아니면 저주인 걸까?성별이 바뀐 게 뭐 대수냐! 손만 멀쩡하다면 다시 피아노를 칠 수 있어!어차피 이렇게 된 거 '타티아나'로서 못다 한 꿈을 이뤄보자!",9.94,2022.05.29 22:55,FALSE,전체연령가,FALSE,https://comic.naver.com/webtoon/list?titleId=772243
771985,모어 라이프,이아영,"스토리, 로맨스","모두가 두 개의 목숨을 가진 세계! 태어날 때부터 목숨이 하나였던 영하는 늘 주변의 걱정과 과보호 속에 자랐다.대학생이 된 후 어렵사리 카페 알바에 도전한 영하, 그곳에서 본인보다 더 평범하지 못한 주희를 만나게 되는데...목숨이 두 개인 세계에서 평범하지 못한 두 남녀의 목숨이 걸린 로맨스!",9.93,2022.06.01 22:56,FALSE,전체연령가,FALSE,https://comic.naver.com/webtoon/list?titleId=771985
728015,모죠의 일지,모죠,"에피소드, 개그",소신있는 취향과 내성적인 성향.훌륭한 집순이 모죠의 은밀한 비밀들,9.97,2021.09.24 22:57,TRUE,전체연령가,TRUE,https://comic.naver.com/webtoon/list?titleId=728015
622648,모태솔로수용소,석재윤,"스토리, 드라마",모태솔로가 중범죄자 취급받는 미래의 한국엉겁결에 잡혀들어온 독고남과 수감자들의 우여곡절 코믹 탈주기,9.92,2015.08.16 23:15,TRUE,15세 이용가,FALSE,https://comic.naver.com/webtoon/list?titleId=622648
666670,모태솔로수용소 시즌2~3,석재윤,"스토리, 드라마","연애를 하지 못하면 범죄자가 되는 세상,모태솔로들의 탈옥이 시작된다!",9.93,2018.09.03 23:02,TRUE,15세 이용가,FALSE,https://comic.naver.com/webtoon/list?titleId=666670
792452,모텔 304호,이말랭,"스토리, 스릴러","취직 면접을 위해 서울로 상경한 '우연',  하룻밤을 묵게 된 고급스러운 모텔의 액자 뒤에서 건너편 방이 보이는 매직미러를 발견한다. 게다가 그곳에 있던 건 국민 걸그룹 릴리즈의 멤버 '수진'. 경찰에 신고하려던 찰나, 수진의 방에 정체불명의 남자가 찾아와 그녀에게 서슬퍼런 칼을 들이민다.일촉즉발의 상황 우연은 수진의 방, 304호로 달려간다.",9.64,2022.06.02 22:53,FALSE,15세 이용가,FALSE,https://comic.naver.com/webtoon/list?titleId=792452
727191,모퉁이 뜨개방,소영,"스토리, 감성",회색빛 일상에 지쳐있던 현이어느 날 만나게 된 모퉁이 뜨개방에서 자신의 상처를 마주하며 치유해간다,9.98,2020.03.18 23:19,TRUE,전체연령가,TRUE,https://comic.naver.com/webtoon/list?titleId=727191
697681,목욕의 신,하일권,"스토리, 드라마",신의 손을 가진 남자최고의 목욕관리사가 되기위한 때밀이 배틀이 시작된다.,9.97,2018.01.16 23:01,TRUE,전체연령가,TRUE,https://comic.naver.com/webtoon/list?titleId=697681
771044,몬스터,이은재,"스토리, 액션","특수기관 '몬스터'에서 아르바이트를 하며 생계를 이어나가고 있는 고등학생 유진. #초능력 보유 #코드네임은 요원D #미션은 데빌 신속제압!유진은 의외로(?) 간단한 자신의 임무를 수행하면서 무난하게 고등학생의 생활을 이어가지만, 어느 날 왕따를 당하는 친구를 도와줬다는 이유로 본인도 같이 왕따를 당하게 된다.평범한 생활에 균열이 생기기 시작하면서 점점 감당하기 힘든 시련이 찾아오게 되고 급기야 지구는 최악의 위기에 처하게 되는데..과연 유진은 이 모든 사건을 해결하고 지구를 구할 수 있을까?",9.62,2022.06.06 22:51,FALSE,15세 이용가,FALSE,https://comic.naver.com/webtoon/list?titleId=771044
778991,몸이 바뀌는 사정,푸릭 / 달꽃 / 윤달,"스토리, 로맨스","황태자는 하룻밤을 보낸 여성과 몸이 바뀌는 저주를 받았고,나는 그 저주를 풀지 못해 멸문당하는 공작가의 딸이 되었다.​저주를 풀고자 무심한 그를 유혹해 하룻밤까지 보냈다.저주 해제약도 먹였겠다, 그에게 관심을 끊었는데……​설상가상 풀려야 할 저주는 풀리지 않고이젠 예고도 없이 수시로 몸이 바뀌게 되었다?​원래 몸으로 돌아가는 방법은 단 하나, 서로의 몸을 탐하는 것뿐.",9.95,2022.06.04 22:51,FALSE,15세 이용가,FALSE,https://comic.naver.com/webtoon/list?titleId=778991
723362,몽연,김종진,"스토리, 드라마",꿈 속에서 만나는 첫사랑. 아내가... 날 의심한다.,9.78,2019.08.15 23:19,TRUE,15세 이용가,TRUE,https://comic.naver.com/webtoon/list?titleId=723362
89098,몽타주,단우,"스토리, 스릴러",<미스터리 호러 지하철>의 단우가 스릴러로 돌아오다. 사람의 얼굴을 기억하지 못하는 전직 형사와 범인의 숨막히는 추격전!,9.91,2010.05.11 00:12,TRUE,18세 이용가,TRUE,https://comic.naver.com/webtoon/list?titleId=89098
644112,몽홀,장태산,"스토리, 무협/사극",차갑고 척박한 땅 몽홀그 곳에서 펼쳐지는 감동의 대서사시,9.91,2022.06.02 22:57,FALSE,전체연령가,FALSE,https://comic.naver.com/webtoon/list?titleId=644112
751208,뫼신 사냥꾼,승림 / 방승현 / 윤현승,"스토리, 판타지","신령과도 같은 짐승 뫼신.떠돌이 무사 한세희는 그들을 사냥하고, 그의 앞에 신비한 힘을 가진 소녀가 나타나는데...",9.93,2022.06.02 22:59,FALSE,15세 이용가,FALSE,https://comic.naver.com/webtoon/list?titleId=751208
784580,묘령의 황자,아흐레달,"스토리, 드라마","여인임을 숨기고 사내로 사는 삶을 택한 4황자 적연. 불사불멸의 신이 될 수 있는 황좌를 두고 열린 경연에 참가한다. 황자는 스무 명, 제위는 하나. 첨예한 대립 속에서 오래된 음모 하나가 서서히 베일을 벗고, 세간에 알려진 바와 달리 점점 두각을 드러내는 적연을 지켜보는 시선들이 어쩐지 짙고 깊어지는데.. 묘령의 황자를 둘러싸고 화려하게 피어나는 애증의 서사시.",9.98,2022.06.03 22:57,FALSE,12세 이용가,FALSE,https://comic.naver.com/webtoon/list?titleId=784580
784827,무능빌런,흰여울 / 이창준,"스토리, 액션",사람을 해치지 못하는 사상 최강의 빌런?스스로를 빌런이라 칭하며 끝없이 어두운 내면을 탐구하는 고교생 김동진.그는 빌런으로선 매우 치명적인 약점을 가지고 있는데…,9.4,2022.01.18 22:00,TRUE,12세 이용가,TRUE,https://comic.naver.com/webtoon/list?titleId=784827
726842,무모협지,초신우,"스토리, 개그",강호를 평정했지만 그를 괴롭히는 한가지 고민그것은 바로 대.머.리.발모제를 향한 그의 모험이 시작된다!,9.95,2020.11.25 23:04,TRUE,12세 이용가,FALSE,https://comic.naver.com/webtoon/list?titleId=726842
746857,무사만리행,운 / 배민기,"스토리, 무협/사극","2세기 후반, 마한 연맹 고리국(古離國)의 무사 나루가로마제국의 검투 노예로 팔려가 자유를 얻기 위해 처절한 사투를 벌인다.",9.93,2022.06.01 22:58,FALSE,15세 이용가,FALSE,https://comic.naver.com/webtoon/list?titleId=746857
778322,무서운게 딱좋아!,이동규,"옴니버스, 스릴러","90년대 생이면 누구나 아는 추억의 공포 만화 <무서운게 딱좋아!>.당시의 독자들이 선정한 베스트 of 베스트 에피소드들을 모아,2021년 웹툰으로 돌아왔다!",9.92,2022.06.04 22:55,FALSE,전체연령가,FALSE,https://comic.naver.com/webtoon/list?titleId=778322
774853,무용과 남학생,이호진,"스토리, 드라마","어릴 적부터 소꿉친구 유연과 함께 발레를 배우던 시우는 어떤 사건으로 인해 발레를 그만두게 된다.그러던 어느날  학교에  발레 하는 남학생 이준이 전학을 오고, 이준과 유연이 예술고등학교 무용과 입시를 준비하는 모습을 보면서 시우는 이준에게 묘한 경계심을 느끼게 되는데…발레와 함께 피어나는 세사람의 알쏭달쏭 첫사랑 로맨스!",9.89,2022.06.07 22:55,FALSE,전체연령가,FALSE,https://comic.naver.com/webtoon/list?titleId=774853
776296,무의식의 숲,루시드,"스토리, 드라마","모든 이들의 꿈이 연결된 세계 ‘무의식의 숲’, 악몽을 만드는 남자와 악몽 속에 빠진 사람들을 탈출 시키려는 남자. 이것은 두 남자의 이야기이며 당신이 잠든 사이 벌어지는 당신의 이야기다.",9.94,2021.08.02 10:00,TRUE,,TRUE,https://comic.naver.com/webtoon/list?titleId=776296
726454,무주의 맹시,마누비,"스토리, 로맨스",삼신할미의 저주를 풀기 위해산신이 되는 세아의 파란만장 고교 생활!,9.95,2021.01.02 23:25,TRUE,전체연령가,TRUE,https://comic.naver.com/webtoon/list?titleId=726454
500944,무한동력,주호민,"스토리, 드라마","'신과함께' 주호민이 청춘에게 전하는 이야기
당신의 꿈은 무엇인가요?",9.93,2013.04.30 23:12,TRUE,전체연령가,FALSE,https://comic.naver.com/webtoon/list?titleId=500944
775218,묵시의 인플루언서,조석,"스토리, 스릴러","어느 날 동네에 생긴 정체 모를 알 하나.알은 빠른 속도로 퍼지더니, 급기야 알에서 나온 괴생명체는 사람들을 죽이기 시작한다. 그리고 이 모든 상황이 실시간으로 중계되는 SNS 계정이 생겼다.",9.9,2022.03.30 22:56,TRUE,15세 이용가,FALSE,https://comic.naver.com/webtoon/list?titleId=775218
63453,묵회,한나,"스토리, 무협/사극","떠돌이 점쟁이 모아의 이야기. 
그녀가 만나는 사람들의 이야기. 그리고 우리의 이야기. 이 세상의 이야기",9.91,2011.06.25 00:08,TRUE,전체연령가,FALSE,https://comic.naver.com/webtoon/list?titleId=63453
710758,문래빗,이난,"스토리, 개그",수 세기 전 용왕에게 몰락한 토끼일족피의 복수를 위해 전학 온 인간 병기 도생원의 해신고 정복기,9.97,2020.09.07 23:24,TRUE,12세 이용가,TRUE,https://comic.naver.com/webtoon/list?titleId=710758
374973,문아,팬마,"스토리, 무협/사극","평범한 삶을 살려는 특별한 사람과 특별한 자신을 찾으려는 평범한 사람
신과 사람의 삶, 그리고 행복에 관한 이야기 - 고려남녀 인간갱생 정신의료 공상만화",9.95,2015.05.26 23:27,TRUE,전체연령가,FALSE,https://comic.naver.com/webtoon/list?titleId=374973
679544,문유,조석,"스토리, 판타지",지구가 멸망했다. 나는 혼자 달에 있다.<마음의 소리> 조석의 우주를 넘나드는 판타지 시크 개그!!,9.96,2017.09.27 23:06,TRUE,12세 이용가,TRUE,https://comic.naver.com/webtoon/list?titleId=679544
756065,물고기가 보이는 남자,차세기,"스토리, 드라마",사람들의 머리 위 물고기를 볼 수 있는 특이한 능력을 가진 남자 “한아리”. 물고기의 비밀을 파헤쳐 가며 벌어지는 놀라운 일들과 그 속에서의 인생 이야기.,9.96,2020.11.02 00:00,TRUE,12세 이용가,TRUE,https://comic.naver.com/webtoon/list?titleId=756065
793887,물고기로 살아남기,동우,"스토리, 판타지","믿었던 동료의 배신으로 죽을 위기에 처한 '이유신'은 죽음의 순간, 한줄기 빛을 보게 된다.""새로운 삶을 다시 시작하시겠습니까?""정신을 차리자 눈앞에 광활한 저수지가 펼쳐져 있었고 몸은 물고기로 변해 있었다.물고기가 되어버린 그는 과연 모든 시련을 이겨내고 가족들의 품으로 돌아갈 수 있을까?",9.19,2022.06.07 22:30,FALSE,15세 이용가,FALSE,https://comic.naver.com/webtoon/list?titleId=793887
737020,물레,고긱,"스토리, 드라마",첫 술자리에서 전과 선언.이거 내 얘기 아니지..?,9.82,2020.11.15 23:17,TRUE,12세 이용가,TRUE,https://comic.naver.com/webtoon/list?titleId=737020
772725,물어보는 사이,성은,"스토리, 로맨스","뱀파이어에게 물리면 건강해진다?!​두통으로 의도치 않게 비호감 연예인이 된 이채이.우연히 톱스타인 서이준이 뱀파이어이고, 그에게 물리면 한동안 건강해진다는 걸 알게 된다.물어달라 부탁하는 채이에게 이준은 계약 연애를 제안하는데...​",9.96,2022.05.15 22:52,FALSE,전체연령가,FALSE,https://comic.naver.com/webtoon/list?titleId=772725
780404,물위의 우리,뱁새 / 왈패,"스토리, 드라마",수차례의 지각변동 이후 해수면이 급격히 상승한 지구. 딸 한별이에게 더 넓은 세상을 보여주고 싶은 호주는 한별이와 고향으로 향한다. 20년 만에 찾은 고향에는 수상한 행적들이 가득한데...과연 둘은 무사히 살아갈 수 있을까?2020 최강자전 최우수상 수상작!,9.97,2022.06.03 22:55,FALSE,15세 이용가,FALSE,https://comic.naver.com/webtoon/list?titleId=780404
607486,미결,꼬마비,"스토리, 드라마","꼬마비 작가의 죽음 3부작 마지막 3부.등장인물 및 배경, 단체명이 실제와 아무런 관계가 없는만화가 '1208'의 이야기.",9.87,2015.01.04 23:18,TRUE,12세 이용가,FALSE,https://comic.naver.com/webtoon/list?titleId=607486
793350,미나 이퀄,이유정,"스토리, 액션","열혈 소방관 강호는 사명감으로 모든 것을 바쳐 많은 사람들을 구해내었으나,돌아온 건, 불구가 된 몸과 처참한 죽임을 당한 아내, 세상으로부터의 배신이었다.그는 자신의 방법대로 복수를 결심하는데, 비록 자신이 구했으나, 새 삶을 살 가치가 없다 판단되는 이들의 목숨을 도로 회수하는 것. 그리곤 그 복수를 이행하기 위해 딸 '미나'를 냉혹한 킬러로 키워낸다. 시간이 흘러 10년 후,고등학생이 된 딸이 킬러로서 완성되었다 생각한 강호는지정한 타겟의 생명을 회수하라는 첫 미션을 내리는데....",9.81,2022.06.03 22:50,FALSE,18세 이용가,FALSE,https://comic.naver.com/webtoon/list?titleId=793350
791616,미니어처 생활백서,엘렌 심,"스토리, 드라마",모르는 할머니가 준 젤리빈을 먹고 작아져버렸다?!소꿉친구 방에 있는 인형의 집에서 지내게 된 18살 남고생의 눈물겨운 생활기!,9.96,2022.06.05 22:52,FALSE,12세 이용가,FALSE,https://comic.naver.com/webtoon/list?titleId=791616
724482,미드나잇 체이서,석재윤,"스토리, 스포츠","고급차에 눈이 멀어 차를 훔친 고은구,불법도박 레이싱에 강제소환되어 위험천만 활극을 펼친다.",9.6,2021.08.04 23:08,TRUE,15세 이용가,TRUE,https://comic.naver.com/webtoon/list?titleId=724482
654817,미라클! 용사님,정하,"스토리, 판타지",X내 나는 용사의 모험이 시작된다!2014 대학만화 최강자전 수상작!,9.96,2017.07.10 23:25,TRUE,전체연령가,TRUE,https://comic.naver.com/webtoon/list?titleId=654817
654318,미래소녀,황준호,"스토리, 스릴러",소녀가 바라본 미래의 기억들<인간의 숲> 황준호 작가의 신작,9.96,2015.12.08 23:07,TRUE,15세 이용가,TRUE,https://comic.naver.com/webtoon/list?titleId=654318
742105,미래의 골동품 가게,구아진,"스토리, 스릴러",저주를 풀기 위한 단 한 가지의 방법. 소중한 것들을 지키기 위한 기묘한 소녀의 퇴마가 시작된다.,9.97,2022.06.07 22:55,FALSE,15세 이용가,FALSE,https://comic.naver.com/webtoon/list?titleId=742105
783529,미물,외눈박이 / 김도연,"옴니버스, 스릴러","도시에는 수많은 벌레들이 살고 있다.사람들의 눈을 피해 자신들만의 왕국을 건설해온 작은 ‘미물’들.어느 날, 모종의 실험으로 유전자가 변형된 벌레들이 도시에 스며들면서 정체를 알 수 없는 존재들이 나타나기 시작한다.",9.87,2022.06.06 22:52,FALSE,15세 이용가,FALSE,https://comic.naver.com/webtoon/list?titleId=783529
557674,미선 임파서블,이수민,"스토리, 드라마",최고의 비밀요원 임미선!그녀에게 주어진 황당한 임무. '평범한 교사'가 될 것!이제 그녀만의 학생지도가 시작된다.,9.92,2015.01.25 23:17,TRUE,12세 이용가,TRUE,https://comic.naver.com/webtoon/list?titleId=557674
452117,미숙한 친구는 G구인,최삡뺩,"스토리, 개그",또띠또띠 뀌꼬르떼 레마르장의 완전 신나는 4차원 지구생활기!,9.94,2013.12.18 23:18,TRUE,전체연령가,FALSE,https://comic.naver.com/webtoon/list?titleId=452117
756059,미스터 해녀,빡세,"스토리, 개그","제주도에 정착한 웹툰작가 빡세,과연 그는 해녀 학교의 모든 훈련을 무사히 마치고해녀왕이 될 수 있을까?",9.17,2020.10.26 00:00,TRUE,전체연령가,TRUE,https://comic.naver.com/webtoon/list?titleId=756059
700361,미스터리 호러 지하철,단우,"스토리, 스릴러","지하철 환수역이 생긴 이후로 59일째마다 사람이 자살을 한다...이게 우연이라고??귀신 따위 믿지는 않지만, 귀신이든 뭐든! 빨리 막지 않으면 며칠 뒤 또 누군가가 자살할지도 몰라...!!",9.97,2018.04.30 23:01,TRUE,15세 이용가,TRUE,https://comic.naver.com/webtoon/list?titleId=700361
770386,미스테리 게임,고경빈,"스토리, 스릴러","인간들은 내 장난감이야. 난 인간들이 좋아.불가사의한 존재들, 그리고 그들이 보여주는 ""당신이 가장 아름답게 빛나는 순간.""",9.75,2021.05.17 10:00,TRUE,,TRUE,https://comic.naver.com/webtoon/list?titleId=770386
761255,미스테리오소,송일곤 / 이제,"스토리, 감성","평범한 재능을 가졌지만, 대기업의 외동딸로 바이올린을 강요당하는 '지나'천재적인 재능을 가졌지만, 가난한 운전사의 딸로 태어나 피아노를 포기한 '경미'경미의 아버지가 지나네 운전사로 일하게 되면서 둘은 만나게 되고 음악이라는 고리를 통해 둘은 가까워진다.음악과 함께한 사춘기 3년, 둘은 우정 그리고 점차 사랑을 느끼게 된다.하지만 세상이 점점 그들을 방해하는데... 과연 둘은 신비롭게 연주할 수 있을까?",9.89,2021.01.11 23:50,TRUE,15세 이용가,TRUE,https://comic.naver.com/webtoon/list?titleId=761255
697533,미시령,모코넛,"스토리, 스릴러","지옥이 되어버린 고개, 미시령. 활을 들어, 이 고개에서 살아남아라.",9.93,2019.06.26 12:16,TRUE,15세 이용가,FALSE,https://comic.naver.com/webtoon/list?titleId=697533
785584,미신,미요커 / 제촘,"스토리, 스릴러","고향에 돌아와 할머니와 살게 된 '하준'과 '하나'그런 아이들을 기다리고 있는 건 수상한 종교, '포신교' 였다.마을 사람들의 ‘포신교’를 향한 광적인 믿음은 점차 커져 ‘하준’과 ‘하나’의 신변에 위협을 끼치는 지경까지 이르게 되는데...",9.54,2022.06.06 22:51,FALSE,15세 이용가,FALSE,https://comic.naver.com/webtoon/list?titleId=785584
616883,미쳐 날뛰는 생활툰,Song,"스토리, 일상",만화가가 되고 싶었던 나날가볍게 그려본 생활툰 하나에 격동하는 주변의 이야기,9.79,2014.11.14 23:19,TRUE,12세 이용가,FALSE,https://comic.naver.com/webtoon/list?titleId=616883
786920,미치도록 너만을,월귤 / 해가 / Lunar 이지연,"스토리, 로맨스","임시보호 중인 고양이를 찾아 호텔 게스트 하우스까지 들어가게 된 인턴 세희.하필 그곳은 하나그룹 이재현 전무가 머무는 곳.인기척 소리에 놀라 욕실에 숨었는데!?관능적인 숨소리와 함께 물줄기가 쏟아지고, 뿌연 수증기가 욕실을 채운다.촤악! 샤워 커튼이 열리고, 재현의 싸늘한 시선과 마주친 세희!“마지막 근무하는 날까지 내 눈앞에 나타나지 말도록”",9.68,2022.06.03 22:00,FALSE,15세 이용가,TRUE,https://comic.naver.com/webtoon/list?titleId=786920
778325,미친 후작을 길들이고 말았다,골지 / 이레 / 로판맛집,"스토리, 로맨스","다이크 가문과 로마니크 황가 사이의 흑막 속에서제3황자 헤이젠에 의해 에스칼은 이용당하고,그런 그를 뒤흔드는 라라노이의 등장에 감춰진 이야기들이 하나씩 밝혀지게 된다.같은 상처를 품은 두 남자는 자신과 정반대의 빛을 가진 라라노이를 사랑하게 되고,사랑을 잘 모르는 두 남자의 삐뚤어진 애정공세는 큰 변화를 몰고오게 되는데…",9.91,2022.06.02 22:57,FALSE,전체연령가,FALSE,https://comic.naver.com/webtoon/list?titleId=778325
188197,미호이야기,혜진양,"스토리, 판타지",이 세상에 처음 나타난 구미호는 자신의 자식 아홉을 잡아먹어야 사람이 된다는 더 웃기지도 않은 저주에 걸린 그저 꼬리가 아홉이나 달린 가여운 숫여우였습니다.,9.96,2011.01.20 20:55,TRUE,전체연령가,TRUE,https://comic.naver.com/webtoon/list?titleId=188197
774868,미혼남녀의 효율적 만남,타리,"스토리, 로맨스","사랑만으론 부족하고 조건만으론 아쉬운 요즘 미혼남녀들의 효율추구 로맨스!마냥 현실적이기도, 마냥 환상을 꿈꾸기도 어려운 나이인 33세의 직장인 이의영.외모보통, 스펙보통인 그녀가 소개팅으로 두 명의 남자를 만난다.<좋아하는 부분> 타리 작가의 현실고증 로맨스 신작.",9.96,2022.06.02 22:51,FALSE,전체연령가,FALSE,https://comic.naver.com/webtoon/list?titleId=774868
737377,민간인 통제구역,OSIK,"스토리, 스릴러",GP 그 이면에 감춰져있던 차마 말하지 못했던 이야기들. 진실은 감출수록 좋다.,9.96,2021.05.14 23:12,TRUE,15세 이용가,TRUE,https://comic.naver.com/webtoon/list?titleId=737377
