id,title,author,genre,description,rating,date,completed,age,free,link
679545,블랙수트,박세준 / 차용운,"스토리, 드라마",발을 들이지 말아야 할 곳에서만나야 할 한 사람을 만나다.,9.67,2017.04.11 23:16,TRUE,12세 이용가,TRUE,https://comic.naver.com/webtoon/list?titleId=679545
612767,블랙시저스,유령,"스토리, 판타지",하얀 악마 차투스와 시저들의 이야기,9.95,2015.08.19 23:22,TRUE,12세 이용가,FALSE,https://comic.naver.com/webtoon/list?titleId=612767
720810,블랙엔젤,MEEN / 이동현,"스토리, 스릴러",타락으로 이끄는 악마들의 속삭임그리고 악마에 맞선 전사들,9.63,2020.04.27 23:07,TRUE,15세 이용가,TRUE,https://comic.naver.com/webtoon/list?titleId=720810
775690,블랙홀과 3만원,김규삼 / 혜원,"스토리, 개그","지구멸망 한달 전, 블랙홀에 빨려들어가 얄짤없이 망하게 생긴 인류. 노스트라 생명에서 인류를 구원할 보험을 출시했다!블랙홀로 인한 모든 피해를 단돈 3만원에 ㅇㅋ?!노스트라의 마지막 히트상품과 함께 나타난 이놈들, 과연 구세주인가 바보들인가.",9.93,2022.06.07 22:58,FALSE,전체연령가,FALSE,https://comic.naver.com/webtoon/list?titleId=775690
783599,블러드 리벤저,고백,"스토리, 판타지",어느 날 정체불명의 괴물 이블에게 습격 당한 '금마루'는 이블을 사냥하는 리벤저 '제이.화이트'에게 도움을 받게 된다.'금마루'는 그 사건을 계기로 오랜 시간 이어져 온 이블과 리벤저 간의 전쟁에 개입하게 되는데...,9.67,2022.06.04 22:53,FALSE,15세 이용가,FALSE,https://comic.naver.com/webtoon/list?titleId=783599
745570,블러드레인,MEEN / 백승훈,"스토리, 액션","국정원과 경찰, 조폭간의 치열한 두뇌싸움. 언더커버로 투입된 투신 강혁의 또다른 신화가 시작된다.",9.88,2020.04.27 10:00,TRUE,전체연령가,TRUE,https://comic.naver.com/webtoon/list?titleId=745570
794415,블러드레인2: 천외천,MEEN / 백승훈,"스토리, 액션","민백두 유니버스 크로스오버의 완결판. 화제의 작품 [블러드 레인]의 후속작이 다른 주인공과 새로운 사건으로 다시 돌아온다.국내 최대 조직을 무너뜨리기 위한 음모와 진실. 그리고 그 뒤에 숨어있는 거대한 흑막.최강의 주먹 이정우, 조폭사냥꾼 김종일, 윤정임의 동생 윤정희, 백발마녀 김성희 등이들을 통해 보여주는 천외천...새로운 세계가 이제 시작된다.",9.22,2022.05.09 10:00,TRUE,,TRUE,https://comic.naver.com/webtoon/list?titleId=794415
737378,블루투스,국승원,"스토리, 판타지",탐사선의 폭발!우주 한가운데 홀로 남겨진 우주 비행사.이 광활하고 고독한 싸움에서 그는 과연 살아남을 수 있을까?,7.29,2021.01.31 23:21,TRUE,전체연령가,TRUE,https://comic.naver.com/webtoon/list?titleId=737378
710390,비둘기가 물고 온 남자,김달님,"스토리, 드라마","도서관 지박령 공시생 안지​혜 눈앞에 떨어진 비둘기, 세상 혼자 사는 잘난 뇌과학자 명석환을 물어오다!<운빨로맨스> 김달님 작가의 처치곤란 로맨스!",9.87,2019.03.06 23:21,TRUE,전체연령가,TRUE,https://comic.naver.com/webtoon/list?titleId=710390
783533,비밀상자,레이카,"스토리, 드라마",엄마가 돌아가신후 엄마에 대해 알아가기 시작한 도시처녀 진이와 재개발마을을 지키려는 순박한 청년 재원. 그리고 유산을 노리는 인물들의 휴먼드라마.,9.85,2021.11.01 10:00,TRUE,,TRUE,https://comic.naver.com/webtoon/list?titleId=783533
423376,비바 산티아고,김용진,"스토리, 일상","스페인을 동에서 서로 가로지르며 천년의 신화를 간직한 ‘산티아고 길’ 
별들의 들판을 향한 800km의 여행이 지금 시작된다.",9.83,2012.09.03 23:04,TRUE,전체연령가,FALSE,https://comic.naver.com/webtoon/list?titleId=423376
743026,비스타,유마,"스토리, 드라마","가수가 되려고 했지만 꿈을 잃고 방황하다어렸을 때 만났던 그 아이를 만나고 다시 찾은 기회,하지만 과거의 업보가 발목을 잡고마는데...",7.07,2021.01.12 23:22,TRUE,전체연령가,FALSE,https://comic.naver.com/webtoon/list?titleId=743026
753384,비스트사인,해밀k / Sodapie,"스토리, 판타지",누나를 대신해 요리 가문의 임시 당주가 된 소년 “한세찬”. 그리고 지상 최강의 짐승이라 자칭하는 “베히모스”까지! 그들이 함께 펼치는 학원 개그 판타지!,8.26,2020.09.28 00:00,TRUE,12세 이용가,TRUE,https://comic.naver.com/webtoon/list?titleId=753384
783022,비인간,김케이,"스토리, 드라마","대규모 집회가 열린 광장에서 정체불명의 바이러스를 유포하던 '인광'은 뉴스팀 '혜나'와 '원식', 보안요원 '형주'에게 꼬리를 밟혀 잡히게 된다.이미 바이러스가 속수무책으로 퍼진 상황. 인광은 이 재난을 멈출 수 있는 유일한 희망이지만 일행은 인광을 혐오하고, 인광은 인간을 혐오한다.",9.92,2022.01.18 22:58,TRUE,15세 이용가,FALSE,https://comic.naver.com/webtoon/list?titleId=783022
791253,비즈니스 여친,루즌아 / 서해,"에피소드, 로맨스",여친 대행업체에서 '여자친구'역할을 하는 루나의 인생역전 스토리.,9.8,2022.06.07 22:50,FALSE,18세 이용가,FALSE,https://comic.naver.com/webtoon/list?titleId=791253
703843,비질란테,CRG / 김규삼,"스토리, 액션",법은 구멍이 나 있다. 내가 그 구멍을 메운다. 널 풀어준 법을 원망해라.,9.98,2021.01.08 23:16,TRUE,15세 이용가,TRUE,https://comic.naver.com/webtoon/list?titleId=703843
794422,비타운,요신 / 김선우,"스토리, 드라마","해고 위기의 기자, 주영.‘기레기’짓이라도 해서 특종을 따내보려 하지만 쉽지 않다.그러던 중, 우연히 주영의 레이더에 포착된 찌라시가 하나 있었으니...바로, 비혼, 비출산의 아이콘으로 유명해진최고의 셀럽 스테파니 진이사실은 애엄마 라는 것!결국, 특종에 목마른 주영은 스테파니의 비밀을 밝히기 위해 비타운에 잠입하기로 작정하는데...!과연, 비혼모 스캔들의 진실은 무엇일까?",8.29,2022.06.02 22:00,FALSE,전체연령가,TRUE,https://comic.naver.com/webtoon/list?titleId=794422
72497,비흔,정재한 / 황영찬,"스토리, 무협/사극","잊혀진 나라 백제, 그리고 싸울아비.패자의 역사 뒤로 전설이 되어 사라진 검은 이리 '흑랑' '비흔'이라는 이름으로 새로운 전설을 시작한다.",9.94,2013.05.18 23:06,TRUE,12세 이용가,FALSE,https://comic.naver.com/webtoon/list?titleId=72497
753839,빅맨,하하영,"스토리, 스포츠",키가 크다는 건 엄청난 축복이라고?208cm인 나한테는 그저 저주일 뿐이다!빅맨 나은덕의 청춘 성장 학원물!!,9.69,2022.06.06 22:58,FALSE,전체연령가,FALSE,https://comic.naver.com/webtoon/list?titleId=753839
750826,빌드업,911,"스토리, 스포츠",축구덕후지만 볼보이만 5년째?! 빵셔틀 강마루의 열혈청춘 축구드라마,9.79,2022.02.08 22:55,TRUE,12세 이용가,FALSE,https://comic.naver.com/webtoon/list?titleId=750826
765156,빌런투킬,퓨핀 / 은지,"스토리, 판타지","동료를 살해했다는 억울한 누명을 쓰고 사망한 카시안. 모든 게 끝이라고 생각한 순간. 그의 영혼은 어느 소년의 몸에 빙의되어 빌런으로 각성한다.선망의 대상이자 대중의 지지를 받던 탑클래스 싸이커였던 그가 하루아침에 빌런이 되다니! 그는 자신의 운명을 받아들이기 힘들다.복수와 분노! 거듭되는 파괴적인 충동으로 이성까지 잠식당할 위기에 처하지만, 신비로운 존재 모로스의 도움과 초인적인 자제력으로 이를 극복해 낸다.“대재앙급이라고?! 어디.. 화끈하게 터트려 볼까!!”",9.89,2022.02.28 22:59,TRUE,15세 이용가,FALSE,https://comic.naver.com/webtoon/list?titleId=765156
632330,빙의,후렛샤 / 김홍태,"스토리, 스릴러",귀신을 믿지 않는 퇴마사그리고 귀신을 보는 소녀,9.97,2015.02.10 23:25,TRUE,15세 이용가,FALSE,https://comic.naver.com/webtoon/list?titleId=632330
695321,빙탕후루,장희 / 주호민,"에피소드, 판타지",<신과 함께> 주호민 작가의 신작! 잔인하고 무자비한 환상 속 요괴들이 현세를 어지럽히는 중국 송나라귀안도사와 여연이 팔귀 퇴치의 여정을 떠난다.,9.96,2020.07.13 23:14,TRUE,15세 이용가,TRUE,https://comic.naver.com/webtoon/list?titleId=695321
748045,빛빛빛,수진,"스토리, 로맨스","우리가 다시 만난다면, 나는 다른 선택을 할 수 있을까엇갈린 첫사랑과의 재회",9.96,2021.07.19 23:14,TRUE,전체연령가,TRUE,https://comic.naver.com/webtoon/list?titleId=748045
776669,빨간맛 로맨스,사지현 / 서루,"스토리, 로맨스","네 피는 뭔가 달라. 참을 수 없을 만큼 달콤해.뱀파이어 도윤이 본능에 이끌려 흡혈을 한 뒤, 하리는 몸무게가 감소했다는 걸 깨닫는다. 먹방을 계속하기 위해 체중 감량이 필요했던 먹방 꿈나무 하리는 도윤에게 계속 흡혈해달라고 부탁한다. 시간이 지날수록 점점 피보다 하리를 더 좋아하게 되어버린 도윤, 그런 도윤의 앞에 하리의 어린 시절 친구라는 새로운 뱀파이어 이든이 등장하는데…….",9.96,2022.06.02 22:53,FALSE,전체연령가,FALSE,https://comic.naver.com/webtoon/list?titleId=776669
651663,빨간책,랑또,"에피소드, 스릴러",생각하면 할 수록 무서운 빨간책 속 이야기. 어디에나 있고 어디에도 없는 것에 대하여.. 랑또 작가의 컷툰 신작.,9.78,2015.06.21 23:21,TRUE,15세 이용가,TRUE,https://comic.naver.com/webtoon/list?titleId=651663
753383,빨강,그냥연어,"스토리, 로맨스","7년의 연애, 7년의 시간에 온전히 녹아든 우리의 마지막",9.79,2020.09.14 00:00,TRUE,12세 이용가,TRUE,https://comic.naver.com/webtoon/list?titleId=753383
764040,빨리감기,"포르토,홍준기 / 홍준기","스토리, 스릴러",시간을 빨리감을 수 있는 명지는 하굣길에 시간을 빨리 감았다가 방금 죽어버린 친구를 앞에 둔 채 정신을 차린다. 영문을 몰라 당황하는 그녀의 앞에 누군가 나타나는데...시간을 조종할 수 있는 또 다른 능력자들의 위협으로부터 명지는 자신과 주변을 지키기 위한 긴박한 싸움을 시작한다.,9.91,2022.01.27 23:00,TRUE,15세 이용가,FALSE,https://comic.naver.com/webtoon/list?titleId=764040
495498,빵점동맹,마사토끼 / joana,"스토리, 드라마",수능이라는  한 판 승부. 그 끝에서 우리를 기다리는것은 무엇일까?그 답을 알기위한 우리들의 동맹.,9.55,2014.02.19 23:12,TRUE,전체연령가,TRUE,https://comic.naver.com/webtoon/list?titleId=495498
794965,사공은주,이체리,"스토리, 스릴러","술집 알바생 '민준'은 어느날 천년의 이상형 '은주'를 보게 된다. 그 후 그녀의 SNS를 찾아내 관음하는 것이 일상이 된 민준.민준은 은주에게 접근하기 위해 옆방으로 이사까지 하지만, 은주 곁엔 늘 깡패 같은 남자친구 '현태'가 있었다.  충격도 잠시, 현태와 싸운 은주가 상처투성이가 되어 나타나자 민준은 크게 분노하고,은주를 현태로부터 구해겠다는 일념 하에 스스럼없이 도를 넘은 행동들을 하며 악질 스토커가 되어간다. 그러던 와중 민준의 방에도 수상한 흔적들이 포착되고, 충격적인 사건들이 원룸 내부에서 벌어진다.",9.73,2022.06.06 22:30,FALSE,15세 이용가,FALSE,https://comic.naver.com/webtoon/list?titleId=794965
727784,사냥개들,정찬,"스토리, 액션","빚 때문에 얽힌 세 명의 젊은이들, 그들이 보여주는 더러운 돈 사냥이 시작된다.",9.78,2020.12.24 23:09,TRUE,18세 이용가,TRUE,https://comic.naver.com/webtoon/list?titleId=727784
66913,사노라면,네이버 웹툰 작가,"옴니버스, 드라마","사노라면 힘든날도 있습니다.하지만 함께 하는 사람들이 있기에 다시 해가 뜰 날을 기대해 봅니다.
서로 기대고 어우러져 힘든 시기를 이겨내는 우리네 사는 이야기",9.77,2009.06.25 00:02,TRUE,전체연령가,FALSE,https://comic.naver.com/webtoon/list?titleId=66913
515883,사또(Satto),최윤진,"스토리, 판타지",인생 역전을 꿈꾸는 당신. 남은 인생을 걸어볼 용기가 있으신가요?복권 한 장에 목숨을 건 사람들. 그 안에서 자신을 찾기 위한 한 소년의 인생 투척 드라마.,9.8,2015.12.29 23:28,TRUE,15세 이용가,FALSE,https://comic.naver.com/webtoon/list?titleId=515883
722725,사라지다,김선우,"스토리, 로맨스",어느 날 갑자기 투명인간이 되어버린 썸녀와의 동거,9.92,2019.04.30 23:21,TRUE,전체연령가,FALSE,https://comic.naver.com/webtoon/list?titleId=722725
758664,사람은 고쳐 쓰는 게 아니...,염라 / 구일하,"스토리, 판타지","나는 신이 제일 먼저 만든 인간이었다. 나는 사랑받는 게 당연해서 타인에게 한번도 사랑을 베풀지 않았다.어느 날, 신이 노하여 내 앞에 나타났고 내게 문제를 내었다.나는 그 문제의 답을 찾을 때까지 마음대로 죽지 못한다.이번에 환생하면 답을 꼭 찾겠어. 그런데... “뺘아아!” 아기 황녀의 몸으로 환생?! 망했다!",9.93,2022.06.04 22:57,FALSE,전체연령가,FALSE,https://comic.naver.com/webtoon/list?titleId=758664
765821,사람의 조각,신의철 / 천범식,"스토리, 스릴러","인간으로서의 의식은 돌아왔지만, 이미 육체는 썩어 죽어가는 ‘치유된 좀비’들.생존한 인간들을 사냥한 후, 온전한 신체를 이식받는 것만이 살아남을 수 있는 유일한 방법이다.조각난 정신과 조각난 육체, 조각난 인간성…이미 깨져버린 ‘사람의 조각’들만 남은 치유자들의 처절한 생존기!",9.93,2022.04.21 22:59,TRUE,15세 이용가,FALSE,https://comic.naver.com/webtoon/list?titleId=765821
15439,사랑in,전세훈,"옴니버스, 로맨스",전세훈의 감성터치-사랑in우리들의 이야기가 수채화 물감처럼 잔잔한 감동으로. 잃어버린 추억과 설렘을 전해드립니다.,9.51,2007.06.27 00:00,TRUE,12세 이용가,FALSE,https://comic.naver.com/webtoon/list?titleId=15439
773187,사랑과 평강의 온달!,한기주 / 일,"스토리, 로맨스","교육직 공무원인 박사랑, 그녀에게는 평생을 바쳐서라도 꼭 해야 하는 일이 있다. 바로 사촌 동생인 평강이(전생 평강공주)의 진짜 인연 '온달'을 찾아주는 것! 그런데 온달을 찾고, 연을 맺어주느라 바쁜 사랑 앞에 미남들이 꼬이는데?!",9.96,2022.06.07 22:56,FALSE,12세 이용가,FALSE,https://comic.naver.com/webtoon/list?titleId=773187
528782,사랑을 연기하다,김작가 / 유성연,"스토리, 드라마","시한부 인생을 선고 받은 남자, 계약 연애를 시작하다.",9.69,2013.06.23 23:02,TRUE,전체연령가,FALSE,https://comic.naver.com/webtoon/list?titleId=528782
792645,사랑의 새싹약국,정해솔 / 이유진,"스토리, 로맨스","스타일 다른 네 명의 꽃미남약사를 전략으로 내세운 '새싹약국'전략이 과했는지 나날이 손님이 늘어가자 약국장 '고찬영'은 고객 감소라는 목표를 가지고과감히 여자 알바를 고용하기로 한다.목표에 정확히 부합하는 지원자를 채용하려던 찰나!건물주 할아버지의 낙하산 줄을 타고 '서 영'이 내려오는데...""내가 왜 저 개똥같은 여자를 고용해야 하는 건데!?""",9.92,2022.06.01 22:00,FALSE,전체연령가,TRUE,https://comic.naver.com/webtoon/list?titleId=792645
297796,사랑의 아쿠아리움,TGM / 린다,"스토리, 드라마","우연한 기회에 수상한 아쿠아리움을 발견한 주인공 김죄형과,
엉뚱하지만 사랑스럽고, 진지하지만 예측불허인 수족관 사람들의 이야기.",9.95,2013.09.22 23:06,TRUE,전체연령가,FALSE,https://comic.naver.com/webtoon/list?titleId=297796
537991,사랑의 외계인,김이랑,"스토리, 드라마",농촌을 무대로 펼쳐지는 기묘한 모험담. 삼수와 이이는 지구를 지킬 수 있을 것인가!'그런지' 김이랑 작가의 신작 판타지 <사랑의 외계인>,9.95,2014.08.28 23:22,TRUE,12세 이용가,TRUE,https://comic.naver.com/webtoon/list?titleId=537991
758667,사랑의 헌옷수거함,고잉,"스토리, 로맨스","짝사랑은 이제 그만! 고잉고등학교에서 가장 핫한 소문, 헌옷수거함에 돈을 넣고 좋아하는 사람의 이름을 외치면 상대방의 마음을 알려준다는데..!연애 대신 성적과 돈에만 관심 있는 송아람은 그런 소문에 휘둘리지 않는다.그런 아람의 일상에 학교 인기남 정진우가 불쑥 들어온다. 어디로 튈지 모르는 이 자식을 어떻게 해야 좋을까?",9.96,2022.06.05 22:57,FALSE,전체연령가,FALSE,https://comic.naver.com/webtoon/list?titleId=758667
492659,사랑일까?,남지은 / 김인호,"스토리, 로맨스","머리부터 발끝까지 단 한 구석도 마음에 들지 않는 그녀!그런데 그녀 때문에 내가 아파. 이게, 사랑일까?남지은, 김인호 작가의 <우연일까?>에 이은 신작, <사랑일까?>",9.93,2013.06.26 23:14,TRUE,전체연령가,FALSE,https://comic.naver.com/webtoon/list?titleId=492659
794644,사랑하는 여배우들,고나리자 / 수정,"스토리, 로맨스","“스타가 된 구 남친 '우주'를 못 잊는 여대생 '초원'에게, 혼수상태에 빠진 국민 여신 '차유진'의 혼령이 빙의했다?!” 억울한 사고의 진실을 찾기 위해 '초원'에게 빙의한 인기 여배우 '유진'은 초원을 배우의 길로 밀어 넣는다. 얼떨결에 연기하게 된 초원은 '국민배우 공연준'에게 차유진의 카피배우 취급을 당하며 우주 앞에서 망신을 당하게 되지만, 점점 자신만의 연기를 찾아 진정한 배우로 성장해간다. 유진 역시 초원의 도움으로 조금씩 사고 당일의 진실에 가까워져 가는데...!",9.88,2022.06.01 22:30,FALSE,전체연령가,FALSE,https://comic.naver.com/webtoon/list?titleId=794644
769801,사막에 핀 달,선지,"스토리, 무협/사극","사막의 전사 나디아. 신녀를 찾아 사막에 온 신관 이세리온은 나디아에게 신녀가 되어달라고 말한다. 나디아는 부족을 지키기 위해 신녀가 되기로 결심하지만, 야만인이라고 무시받는 상황에서 나디아는 과연 진짜 신녀가 될 수 있을까? 신녀로 선택받은 나디아와 신관 이세리온의 이야기.",9.8,2022.06.05 22:54,FALSE,전체연령가,FALSE,https://comic.naver.com/webtoon/list?titleId=769801
748536,사상최강,이단아 / 황규영,"스토리, 판타지",‘천하 십대 고수’라고 불리는 자들. 인간의 한계를 뛰어넘은 그들은 서로를 견제하며 힘의 균형과 세상의 질서를 유지해왔다.바로 ‘백도현’ 그가 나타나기 전까지는! 내공만으로 사상최강의 힘을 가진 남자 백도현의 시원한 한 방!,9.88,2022.06.07 22:55,FALSE,전체연령가,FALSE,https://comic.naver.com/webtoon/list?titleId=748536
793312,사생활 체크,리기 / 와치,"스토리, 드라마","흙수저 사이버렉카 고교생. 명문고 학생들의 비밀을 온에어(ONAIR)하다!'세상 모든 이슈를 퍼 나르는 사이버 렉카 고교생 이차성. 재벌과 유명인 자제들이 즐비한 명문 한빛고에 사회배려자 전형으로 입학해 고위층 학생들의 비밀스러운 사생활을 목격하게 된다. 정체를 숨긴 채 운영중인 뉴튜브 렉카 채널에 목격한 사건을 업로드하는 차성. 영상은 큰 인기를 끌지만 차성이 사이버 렉카임을 알고 있는 미지의 인물이 연락해오고, 채널이 인기를 얻을수록 차성은 걷잡을 수 없는 사건에 휘말리게 되는데…",9.67,2022.06.07 22:00,FALSE,12세 이용가,TRUE,https://comic.naver.com/webtoon/list?titleId=793312
780845,사서고생!,몽실,"에피소드, 드라마","이름 안은수, 나이 23세, 대기업 고졸 정규직, 4년차 직장인.재미는 없어도 무소식이 희소식인 법. 이대로만 살면 더 바랄 게 없는 일상이었지만 주변 상황들은 그런 은수를 가만히 내버려두지 않고..사서 고생, 살아서 고생! 제대로된 어른이 되고 싶은 애어른 안은수의 청춘성장드라마!",9.93,2022.06.03 22:57,FALSE,전체연령가,FALSE,https://comic.naver.com/webtoon/list?titleId=780845
730811,사소한 냐냐,LICO,"에피소드, 일상",움직이는 웹툰 숏애니! 4개월 이후 중성화 수술을 하게 되는 '냐냐'과연 사.소(사이코패스+소시오패스)한 고양이로 거듭나 땅콩을 사수할 수 있을까?!,9.86,2020.07.05 23:05,TRUE,전체연령가,FALSE,https://comic.naver.com/webtoon/list?titleId=730811
730656,사신소년,류,"스토리, 액션","수명을 대가로 죽은 자의 능력을 빌리는 소년! 화려한 액션에서 부터 스포츠, 두뇌 플레이까지 한계는 없다!",9.92,2022.05.23 23:00,FALSE,15세 이용가,FALSE,https://comic.naver.com/webtoon/list?titleId=730656
774865,사실 마법이었던 거임,박성현,"스토리, 개그",<사장님을 잠금해제> 박성현 작가의 예측불가 개그 신작!마술인 줄 알았는데 사실은 마법이었다!?마법사 <이스트 도널드 우르사우르스>는 인간계로 유배되어 '이도우'라는 이름으로 살아가고 있다. 고등학교를 무사히 졸업해야만 마법계로 돌아갈 수 있다는데..!도우는 평범한 학교생활을 하고 싶지만 주변에서 가만히 내버려 두질 않는다. 수많은 위기를 극복하고 다시 마법계로 돌아갈 수 있을까?,9.93,2022.06.04 22:59,FALSE,전체연령가,FALSE,https://comic.naver.com/webtoon/list?titleId=774865
784810,사심폭발 로망스,상림(메리J) / 묘묘리,"스토리, 로맨스","재력, 능력, 마성의 매력 그리고 신이 공들여 빚은 Masterpiece라 불리는 빛나는 외모까지 겸비한 탐나는 남자, 마윤 그룹의 후계자 마성훈.그러나 여자를 질색한다는 치명적 약점이 있었으니. 성훈을 둘러싼 하반신 몹쓸설, 고자설, 게이설을 잠재우기 위해 특파된 여자, 강덕심.오늘부터 깐깐하고 고리타분한 중년의 여비서로 새로 태어나 그의 곁에서 살아남아야 한다. 10억을 위해 그리고 잘생긴 얼굴을 보기 위해!",9.64,2022.05.18 22:00,FALSE,전체연령가,TRUE,https://comic.naver.com/webtoon/list?titleId=784810
726211,사우러스,이노,"스토리, 판타지",다시 돌아온 공룡의 시대! 무너진 인류 문명을 지키려는 자들과 이를 방해하려는 세력의 치열한 전투가 시작된다.,9.84,2020.10.29 23:25,TRUE,전체연령가,TRUE,https://comic.naver.com/webtoon/list?titleId=726211
616238,사이드킥,신의철,"스토리, 판타지",슈퍼히어로의 조수 '사이드킥'진정한 영웅으로 성장해 나가는 그들의 스펙타클 액션 판타지!,9.93,2015.02.24 23:09,TRUE,15세 이용가,TRUE,https://comic.naver.com/webtoon/list?titleId=616238
642653,사이드킥 2~3,신의철,"스토리, 판타지",슈퍼히어로의 조수 '사이드킥' 악당 빌런들과 맞서 싸우는 슈퍼히어로와사이드킥들의 이야기!,9.97,2020.11.16 23:01,TRUE,15세 이용가,TRUE,https://comic.naver.com/webtoon/list?titleId=642653
743031,사장님을 잠금해제,박성현,"스토리, 개그","얼떨결에 죽어 스마트폰이 된 39살 대기업 천재 CEO 선주,얼떨결에 그 스마트폰을 주운 29살 취준생 인성,아홉수 두 사람이 힘을 합쳐 살인범을 찾는다.",9.94,2021.04.25 23:11,TRUE,전체연령가,TRUE,https://comic.naver.com/webtoon/list?titleId=743031
784828,사파리 로맨스,yoshua / 윤정,"스토리, 로맨스","""그 많던 바나나는 누가 다 먹었을까?""낮에는 동물원 사육사로 일하는, 28년 모태솔로 봉우리! 남들은 다~~~해봤다는 연애 한 번 못해봤다!외로운 사육사 봉우리, 그러나 밤만 되면 본능, 육감 충실 19금 로맨스 소설 ""사파리 로맨스"" 작가 교미인으로 변신!넘치는 욕망을 과감하게 분출하는데...한편, 동물원의 새로운 원장 강산호는 우연히 교미인의 소설을 읽게 되고잠잠하던 그의 욕망이 교미인의 육감적인 소설에만 일어선다!",9.62,2022.06.01 22:00,FALSE,전체연령가,TRUE,https://comic.naver.com/webtoon/list?titleId=784828
795262,사형소년,"박태준만화회사, 김숭늉 / 광산","스토리, 스릴러",대한민국을 뒤흔든 희대의 연쇄살인마 김신! 김신에게 가족을 잃은 지후는 또 다른 피해자 두석을 만나 인간병기로 훈련된다.그리고 살인마를 맨주먹으로 때려죽이기 위해 스스로 교도소로 향하는데...'우리나라는 97년 이후로 사형집행이 되지 않았어. 누군가는 집행해야 하지 않을까?',9.56,2022.06.04 22:30,FALSE,15세 이용가,FALSE,https://comic.naver.com/webtoon/list?titleId=795262
778740,산신의 주인입니다,뇽,"스토리, 로맨스","요괴의 저주를 받아 심장을 잃은 산신이1000년의 근신생활 끝에 자신의 심장을 찾아 인간세상으로 나오면서 벌어지는 시끌벅적 코믹 로맨스판타지 ""심장아, 나 너 찾고있냐...?""",9.85,2021.09.20 10:00,TRUE,,TRUE,https://comic.naver.com/webtoon/list?titleId=778740
